{
  "schema_version": "1.0.0",
  "plan_id": "plan-9be88141985f",
  "source_brief_id": "brief-pf03-scenario1",
  "source_request_id": "req-pf03-scenario1",
  "project_snapshot": {
    "project_id": "proj-pf03-scenario1",
    "base_revision": 1,
    "snapshot_sha256": "b4db858784db5977c66f21a863face7b4158a74f241e623eb344d1e16cc6db70",
    "timebase_ticks_per_second": 120000
  },
  "target_duration_ticks": 1440000,
  "operations": [
    {
      "op_id": "op-trim-1",
      "step_index": 0,
      "type": "trim_clip",
      "target_id": "clip_1",
      "params": {
        "clipId": "clip_1",
        "startTick": 0,
        "durationTicks": 480000,
        "sourceStartTick": 0
      },
      "dependencies": [],
      "preconditions": {
        "expectedBaseRevision": 1
      },
      "expected_effects": {
        "description": "Trim primary clip clip_1 to 480000 ticks",
        "affected_field": "durationTicks",
        "resulting_ticks": 480000
      }
    },
    {
      "op_id": "op-move-1",
      "step_index": 1,
      "type": "move_clip",
      "target_id": "clip_1",
      "params": {
        "clipId": "clip_1",
        "targetTrackId": "track_v_main",
        "targetTick": 0
      },
      "dependencies": [
        "op-trim-1"
      ],
      "preconditions": {
        "expectedBaseRevision": 2
      },
      "expected_effects": {
        "description": "Position primary clip clip_1 at tick 0",
        "affected_field": "startTick",
        "resulting_ticks": 0
      }
    },
    {
      "op_id": "op-trim-2",
      "step_index": 2,
      "type": "trim_clip",
      "target_id": "clip_2",
      "params": {
        "clipId": "clip_2",
        "startTick": 480000,
        "durationTicks": 480000,
        "sourceStartTick": 0
      },
      "dependencies": [
        "op-move-1"
      ],
      "preconditions": {
        "expectedBaseRevision": 3
      },
      "expected_effects": {
        "description": "Trim primary clip clip_2 to 480000 ticks",
        "affected_field": "durationTicks",
        "resulting_ticks": 480000
      }
    },
    {
      "op_id": "op-move-2",
      "step_index": 3,
      "type": "move_clip",
      "target_id": "clip_2",
      "params": {
        "clipId": "clip_2",
        "targetTrackId": "track_v_main",
        "targetTick": 480000
      },
      "dependencies": [
        "op-trim-2"
      ],
      "preconditions": {
        "expectedBaseRevision": 4
      },
      "expected_effects": {
        "description": "Position primary clip clip_2 at tick 480000",
        "affected_field": "startTick",
        "resulting_ticks": 480000
      }
    },
    {
      "op_id": "op-trim-3",
      "step_index": 4,
      "type": "trim_clip",
      "target_id": "clip_3",
      "params": {
        "clipId": "clip_3",
        "startTick": 960000,
        "durationTicks": 480000,
        "sourceStartTick": 0
      },
      "dependencies": [
        "op-move-2"
      ],
      "preconditions": {
        "expectedBaseRevision": 5
      },
      "expected_effects": {
        "description": "Trim primary clip clip_3 to 480000 ticks",
        "affected_field": "durationTicks",
        "resulting_ticks": 480000
      }
    },
    {
      "op_id": "op-move-3",
      "step_index": 5,
      "type": "move_clip",
      "target_id": "clip_3",
      "params": {
        "clipId": "clip_3",
        "targetTrackId": "track_v_main",
        "targetTick": 960000
      },
      "dependencies": [
        "op-trim-3"
      ],
      "preconditions": {
        "expectedBaseRevision": 6
      },
      "expected_effects": {
        "description": "Position primary clip clip_3 at tick 960000",
        "affected_field": "startTick",
        "resulting_ticks": 960000
      }
    },
    {
      "op_id": "op-insert-music",
      "step_index": 6,
      "type": "insert_clip",
      "target_id": "clip_music",
      "params": {
        "id": "clip_music",
        "trackId": "track_a_music",
        "type": "audio",
        "startTick": 0,
        "durationTicks": 1440000,
        "source": {
          "assetId": "asset_a_music",
          "trimInTick": 0,
          "trimOutTick": 1440000
        },
        "audio": {
          "volume": 1
        }
      },
      "dependencies": [],
      "preconditions": {
        "expectedBaseRevision": 7
      },
      "expected_effects": {
        "description": "Insert music clip at tick 0 on track track_a_music for 1440000 ticks",
        "affected_field": "durationTicks",
        "resulting_ticks": 1440000
      }
    },
    {
      "op_id": "op-insert-broll",
      "step_index": 7,
      "type": "insert_clip",
      "target_id": "clip_broll",
      "params": {
        "id": "clip_broll",
        "trackId": "track_v_broll",
        "type": "video",
        "startTick": 480000,
        "durationTicks": 240000,
        "source": {
          "assetId": "asset_v_broll",
          "trimInTick": 0,
          "trimOutTick": 240000
        }
      },
      "dependencies": [
        "op-move-2"
      ],
      "preconditions": {
        "expectedBaseRevision": 8
      },
      "expected_effects": {
        "description": "Insert B-roll cutaway at [480000, 720000) on track track_v_broll",
        "affected_field": "durationTicks",
        "resulting_ticks": 240000
      }
    },
    {
      "op_id": "op-apply-transition-1",
      "step_index": 8,
      "type": "apply_effect",
      "target_id": "clip_1",
      "params": {
        "clipId": "clip_1",
        "effect": {
          "type": "transition",
          "parameters": {
            "transitionType": "cross_dissolve",
            "durationTicks": 120000,
            "alignment": "centered",
            "targetClipId": "clip_2"
          }
        }
      },
      "dependencies": [
        "op-move-1",
        "op-move-2"
      ],
      "preconditions": {
        "expectedBaseRevision": 9
      },
      "expected_effects": {
        "description": "Apply 1-second cross_dissolve transition between clip_1 and clip_2",
        "affected_field": "effects",
        "resulting_ticks": 120000
      }
    },
    {
      "op_id": "op-insert-title",
      "step_index": 9,
      "type": "insert_clip",
      "target_id": "clip_title",
      "params": {
        "id": "clip_title",
        "trackId": "track_graphics",
        "type": "text",
        "startTick": 0,
        "durationTicks": 360000,
        "typography": {
          "text": "EME Master Edition",
          "fontSize": 54,
          "color": "#ffffff",
          "fontAssetId": "asset_f_headline",
          "textAlign": "center"
        }
      },
      "dependencies": [],
      "preconditions": {
        "expectedBaseRevision": 10
      },
      "expected_effects": {
        "description": "Insert title text overlay during first 3 seconds on track track_graphics",
        "affected_field": "durationTicks",
        "resulting_ticks": 360000
      }
    }
  ],
  "diagnostics": {
    "unsupported_requests": [],
    "missing_references": [],
    "conflicts": [],
    "rejected_operations": []
  },
  "dry_run": {
    "success": true,
    "simulated_steps": 10,
    "final_revision": 11,
    "affected_tracks": [
      "track_v_main",
      "track_a_music",
      "track_v_broll",
      "track_graphics"
    ],
    "affected_clips": [
      "clip_1",
      "clip_2",
      "clip_3",
      "clip_music",
      "clip_broll",
      "clip_title"
    ],
    "timing_implications": {
      "start_tick": 0,
      "end_tick": 1440000,
      "duration_ticks": 1440000,
      "duration_seconds": 12
    },
    "invariant_checks": {
      "preserved_properties_verified": true,
      "track_locks_respected": true,
      "zero_leak_integrity": true
    }
  },
  "validation": {
    "status": "ready",
    "blocking_issue_ids": []
  }
}